{
  "$schema": "../../../../../../../app/schemas/smart-component.schema.json",
  "type": "spiral-column",
  "kind": "stair-support",
  "title": "Spiral Column Support",
  "version": 1,
  "roles": {
    "centerColumn": "_center_column",
    "supportPattern": "_support_pattern",
    "supportAssembly": "_support_assembly"
  },
  "parameters": {},
  "presets": {
    "spiral-column": {
      "id": "spiral-column",
      "version": "0.1.0",
      "name": "Spiral column",
      "parameters": {
        "meta": {
          "family": "spiral-column"
        }
      }
    }
  },
  "ui": {
    "tabs": [
      {
        "id": "support",
        "label": "Support",
        "items": []
      }
    ]
  },
  "components": []
}
